The ruling ideas of each age have ever been the ideas of its ruling class.;Karl Marx;age
In the information age, you don't teach philosophy as they did after feudalism. You perform it. If Aristotle were alive today he'd have a talk show.;Timothy Leary;age
Once I planned to write a book of poems entirely about the things in my pocket. But I found it would be too long and the age of the great epics is past.;Gilbert K. Chesterton;age
The harvest of old age is the recollection and abundance of blessing previously secured.;Marcus Tullius Cicero;age
It is the spirit of the age to believe that any fact, no matter how suspect, is superior to any imaginative exercise, no matter how true.;Gore Vidal;age
The arrogance of age must submit to be taught by youth.;Edmund Burke;age
